[
  {
    "schema_version": "2.0.0",
    "record_type": "identified_commitment",
    "institution": "G20",
    "summit_id": "G20.rio.2024",
    "commitment_id": "2024-122",
    "exact_text": "We support reliable, diversified, sustainable and responsible supply chains for energy transitions, including for critical minerals and materials beneficiated at source, semiconductors and technologies.",
    "issue_areas": [
      {
        "source_term": "Energy: Energy Transition Supply Chains",
        "vocabulary_mapping_id": "g20.2024-rio.issue.energy_transition_supply_chains"
      }
    ],
    "source_passage_ids": [
      "g20.2024-rio.commitment.2024-122"
    ],
    "parser_version": "g20-2024-rio-adapter@2.0.0",
    "retrieval_date": "2026-07-24",
    "extraction_warnings": []
  },
  {
    "schema_version": "2.0.0",
    "record_type": "identified_commitment",
    "institution": "G20",
    "summit_id": "G20.rio.2024",
    "commitment_id": "2024-150",
    "exact_text": "We reaffirm our commitment in the New Delhi Leaders’ Declaration to collectively mobilize more headroom and concessional finance to boost World Bank capacity to help low- and middle-income countries that need help in addressing global challenges, with a clear framework for the allocation of scarce concessional resources, and to provide strong support for the poorest countries.",
    "issue_areas": [
      {
        "source_term": "Development: Financial Support for Low- and Middle-Income Countries",
        "vocabulary_mapping_id": "g20.2024-rio.issue.development_financial_support_lmics"
      }
    ],
    "source_passage_ids": [
      "g20.2024-rio.commitment.2024-150"
    ],
    "parser_version": "g20-2024-rio-adapter@2.0.0",
    "retrieval_date": "2026-07-24",
    "extraction_warnings": []
  },
  {
    "schema_version": "2.0.0",
    "record_type": "identified_commitment",
    "institution": "G20",
    "summit_id": "G20.rio.2024",
    "commitment_id": "2024-168",
    "exact_text": "[We]…support the African Union to realize the trade and economic integration and aspirations under its Agenda 2063 as it enters its second decade of implementation.",
    "issue_areas": [
      {
        "source_term": "Development: Integration of the African Union",
        "vocabulary_mapping_id": "g20.2024-rio.issue.development_african_union_integration"
      }
    ],
    "source_passage_ids": [
      "g20.2024-rio.commitment.2024-168"
    ],
    "parser_version": "g20-2024-rio-adapter@2.0.0",
    "retrieval_date": "2026-07-24",
    "extraction_warnings": []
  },
  {
    "schema_version": "2.0.0",
    "record_type": "identified_commitment",
    "institution": "G20",
    "summit_id": "G20.rio.2024",
    "commitment_id": "2024-137",
    "exact_text": "In order to deliver on the promises of the United Nations and other relevant international organizations around the world, we pledge to work for a reinvigorated and strengthened multilateral system, rooted in the purposes and principles of the UN Charter and international law, with renewed institutions and a reformed governance that is more representative, effective, transparent and accountable, reflecting the social, economic and political realities of the 21st century.",
    "issue_areas": [
      {
        "source_term": "Institutional Reform: Reforming Global Governance Institutions",
        "vocabulary_mapping_id": "g20.2024-rio.issue.institutional_reform_global_governance"
      }
    ],
    "source_passage_ids": [
      "g20.2024-rio.commitment.2024-137"
    ],
    "parser_version": "g20-2024-rio-adapter@2.0.0",
    "retrieval_date": "2026-07-24",
    "extraction_warnings": []
  },
  {
    "schema_version": "2.0.0",
    "record_type": "identified_commitment",
    "institution": "G20",
    "summit_id": "G20.rio.2024",
    "commitment_id": "2024-102",
    "exact_text": "We recognize the need for deep, rapid and sustained reductions in greenhouse gas emissions in line with 1.5 C pathways [and call on members to contribute to the global efforts against climate change, in a nationally determined manner, taking into account the Paris Agreement and their different national circumstances, pathways and approaches, as addressed in GST-1.].",
    "issue_areas": [
      {
        "source_term": "Climate Change: Greenhouse Gas Reduction",
        "vocabulary_mapping_id": "g20.2024-rio.issue.climate_change_ghg_reduction"
      }
    ],
    "source_passage_ids": [
      "g20.2024-rio.commitment.2024-102"
    ],
    "parser_version": "g20-2024-rio-adapter@2.0.0",
    "retrieval_date": "2026-07-24",
    "extraction_warnings": []
  },
  {
    "schema_version": "2.0.0",
    "record_type": "identified_commitment",
    "institution": "G20",
    "summit_id": "G20.rio.2024",
    "commitment_id": "2024-78",
    "exact_text": "We commit to accelerating international disaster risk reduction cooperation in line with the Sendai Framework for Disaster Risk Reduction.",
    "issue_areas": [
      {
        "source_term": "Climate Change: Disaster Risk Reduction",
        "vocabulary_mapping_id": "g20.2024-rio.issue.climate_change_disaster_risk_reduction"
      }
    ],
    "source_passage_ids": [
      "g20.2024-rio.commitment.2024-78"
    ],
    "parser_version": "g20-2024-rio-adapter@2.0.0",
    "retrieval_date": "2026-07-24",
    "extraction_warnings": []
  },
  {
    "schema_version": "2.0.0",
    "record_type": "identified_commitment",
    "institution": "G20",
    "summit_id": "G20.rio.2024",
    "commitment_id": "2024-124",
    "exact_text": "We reaffirm the commitment to the swift, full, and effective implementation of the Kunming-Montreal Global Biodiversity Framework (KM-GBF) adopted at the COP15 to the Convention on Biological Diversity (CBD).",
    "issue_areas": [
      {
        "source_term": "Environment: Biodiversity",
        "vocabulary_mapping_id": "g20.2024-rio.issue.environment_biodiversity"
      }
    ],
    "source_passage_ids": [
      "g20.2024-rio.commitment.2024-124"
    ],
    "parser_version": "g20-2024-rio-adapter@2.0.0",
    "retrieval_date": "2026-07-24",
    "extraction_warnings": []
  },
  {
    "schema_version": "2.0.0",
    "record_type": "identified_commitment",
    "institution": "G20",
    "summit_id": "G20.rio.2024",
    "commitment_id": "2024-43",
    "exact_text": "We remain committed to building more resilient, equitable, sustainable, and inclusive health systems for the provision of integrated people-centered health services, including mental health.",
    "issue_areas": [
      {
        "source_term": "Health: Inclusive Health Systems",
        "vocabulary_mapping_id": "g20.2024-rio.issue.health_inclusive_health_systems"
      }
    ],
    "source_passage_ids": [
      "g20.2024-rio.commitment.2024-43"
    ],
    "parser_version": "g20-2024-rio-adapter@2.0.0",
    "retrieval_date": "2026-07-24",
    "extraction_warnings": []
  },
  {
    "schema_version": "2.0.0",
    "record_type": "identified_commitment",
    "institution": "G20",
    "summit_id": "G20.rio.2024",
    "commitment_id": "2024-10",
    "exact_text": "Our fiscal policies will safeguard fiscal sustainability and rebuild buffers, remain growth-friendly, and catalyze public and private investments towards productivity enhancing reforms.",
    "issue_areas": [
      {
        "source_term": "Macroeconomics: Fiscal Policy",
        "vocabulary_mapping_id": "g20.2024-rio.issue.macroeconomics_fiscal_policy"
      }
    ],
    "source_passage_ids": [
      "g20.2024-rio.commitment.2024-10"
    ],
    "parser_version": "g20-2024-rio-adapter@2.0.0",
    "retrieval_date": "2026-07-24",
    "extraction_warnings": []
  },
  {
    "schema_version": "2.0.0",
    "record_type": "identified_commitment",
    "institution": "G20",
    "summit_id": "G20.rio.2024",
    "commitment_id": "2024-16",
    "exact_text": "While expressing our deep concern about the catastrophic humanitarian situation in the Gaza Strip and the escalation in Lebanon, we emphasize the urgent need to expand the flow of humanitarian assistance and to reinforce the protection of civilians [and demand the lifting of all barriers to the provision of humanitarian assistance at scale.]",
    "issue_areas": [
      {
        "source_term": "Regional Security: Humanitarian Efforts in Gaza and Lebanon",
        "vocabulary_mapping_id": "g20.2024-rio.issue.regional_security_gaza_lebanon_humanitarian"
      }
    ],
    "source_passage_ids": [
      "g20.2024-rio.commitment.2024-16"
    ],
    "parser_version": "g20-2024-rio-adapter@2.0.0",
    "retrieval_date": "2026-07-24",
    "extraction_warnings": []
  },
  {
    "schema_version": "2.0.0",
    "record_type": "identified_commitment",
    "institution": "G20",
    "summit_id": "G20.rio.2024",
    "commitment_id": "2024-25",
    "exact_text": "We also aim to address the challenges of fertilizer shortages, including through strengthening local production, trade, increase fertilizer efficiency, and utilize biofertilizers while addressing the need to improve soil health and minimize water pollution.",
    "issue_areas": [
      {
        "source_term": "Food and Agriculture: Fertilizer Shortages",
        "vocabulary_mapping_id": "g20.2024-rio.issue.food_agriculture_fertilizer_shortages"
      }
    ],
    "source_passage_ids": [
      "g20.2024-rio.commitment.2024-25"
    ],
    "parser_version": "g20-2024-rio-adapter@2.0.0",
    "retrieval_date": "2026-07-24",
    "extraction_warnings": []
  },
  {
    "schema_version": "2.0.0",
    "record_type": "identified_commitment",
    "institution": "G20",
    "summit_id": "G20.rio.2024",
    "commitment_id": "2024-32",
    "exact_text": "We commit to implementing the G20 Roadmap Towards and Beyond the Brisbane Goal.",
    "issue_areas": [
      {
        "source_term": "Gender Equality: Labour Markets",
        "vocabulary_mapping_id": "g20.2024-rio.issue.gender_equality_labour_markets"
      }
    ],
    "source_passage_ids": [
      "g20.2024-rio.commitment.2024-32"
    ],